{
  "model_name": "gemini-live-2.5-flash-native-audio",
  "model_organization": "Google",
  "submitting_organization": "Sierra",
  "submission_date": "2026-03-03",
  "submission_type": "standard",
  "modality": "voice",
  "contact_info": {
    "email": "victor@sierra.ai",
    "name": "Sierra Research Team"
  },
  "is_new": true,
  "trajectories_available": false,
  "results": {
    "airline": {
      "pass_1": 30.0
    },
    "retail": {
      "pass_1": 29.8
    },
    "telecom": {
      "pass_1": 17.5
    }
  },
  "voice_config": {
    "provider": "gemini",
    "model": "gemini-live-2.5-flash-native-audio",
    "tick_duration_seconds": 0.2,
    "max_steps_seconds": 600,
    "user_tts_provider": "elevenlabs/eleven_v3"
  },
  "methodology": {
    "evaluation_date": "2026-03-03",
    "tau2_bench_version": "1.0.0",
    "user_simulator": "v1.0",
    "notes": "Full-duplex audio-native evaluation using regular speech complexity (realistic audio conditions). 1 trial per task.",
    "verification": {
      "modified_prompts": false,
      "omitted_questions": false
    }
  }
}
